,Job_ID,Job_Title,Company_Name,Location,Job_Description,Python,R ,Matlab,Excel,SAS,SQL,SPSS,Hadoop,Spark
173,e21c9861ce486523,Quality Assurance (QA) Specialist,BlueRock Therapeutics,"Toronto, ON","['Draft SOPs and work with team members to draft documents for cGMP manufacturing and Quality Control testing. Review documents and coordinate the document review and approval processes.', 'Provide document control support including issuance of controlled documents, document tracking, processing, and archiving. Provide support for management of document change control and coordinate the revision, review, and approval of SOPs and other GMP documents.', 'Organize and ensure accurate and reliable systems for archiving cGMP documents in paper and/or electronic format.\n', 'Work with team members to draft, review and approve specifications and protocols for qualification and validation studies. Coordinate review, approval, and archiving of qualification and validation reports.', 'Assist in establishing training programs to support cGMP operations. Facilitate the training program and establish training files to document training status of staff.', 'Work with Quality Control and shipping to document the receipt, quarantine, inspection and release of raw materials and manufactured materials used for cGMP manufacturing and QC testing.', 'Assist in the review of batch records and close-out of deviations. Issue and reconcile labels for final product.', 'Perform risk assessments and close out of engineering work orders for equipment and areas used for cGMP manufacturing.\n', 'Audit internal facilities and systems for compliance to SOPs, cGMP regulations, and other applicable regulations.\n', 'Participate in audits by external clients and regulatory authorities.', 'Assist in audits of raw material and contract testing labs for compliance with cGMP and GLP requirements.', 'Assist in Quality Investigations by coordinating OOS and Deviation investigations and executing CAPA procedures including facilitating identification of root cause, risk assessments and implementing corrective actions with monitoring for effectiveness.', 'Assist in the preparation of regulatory documents including briefing documents, IND filings, and Drug/Facility Master Files.', 'Assist in the management and maintenance of the electronic Quality Management System.', 'Manage notebook and logbook issuance and data archival activities.', 'Other duties as assigned', 'Minimum of a Bachelor’s degree in Biology or relevant scientific or engineering discipline', 'Minimum of 5 years of hands-on experience in a quality role within a regulated life sciences environment (biotechnology/pharmaceutical/medical device) is required; experience with combination products is a plus', 'Experience with MasterControl is an asset', 'Experience with auditing, investigations and/or electronic quality management systems is desired', 'Must be detail-oriented with excellent organizational skills', 'Strong technical writing skills with working knowledge of MS office programs, such as Word, Excel, SharePoint, Access and Adobe Acrobat professional are required', 'Must be self-motivated with the demonstrated ability to work effectively with people from multiple departments, ensure deadlines are met, and manage multiple, potentially changing, priorities.', 'Proven ability to identify quality issues and effectively and proactively resolve issues in a team setting.', 'Previous experience in a mentoring/leadership role is desired', 'Ability to travel approximately 20-30%, mostly to other BlueRock sites in Cambridge, MA and New York City']",0,0,0,1,0,0,0,0,0
174,7dae82b6fb7905cd,Software Development Manager Performance Advertising,Amazon Advertising Canada Inc.,"Toronto, ON","['Ability to get a lot done in a startup environment with a mix of ambiguity and opportunity', 'Willingness to roll up your sleeves and do whatever is necessary – a general manager / owner mentality and an entrepreneurial drive', 'Ability to have fun and inspire team members to enjoy work, be action-oriented and stretch their imagination', 'Ability to earn trust across different levels and multiple groups of a large organization', 'Fluency in working with technology and digital media', 'Exceptional ability to analyze and interpret large amounts of data in order to make recommendations for improvement', 'Strong oral and written communication skills, as well as ability to think clearly, analyze quantitatively, solve problems, scope technical requirements and prioritize project work', 'Sound business judgment, proven ability to influence others, and strong analytical thinking skills', 'Ability to think strategically and act tactically', 'Knowledge of statistical analysis and/or machine learning', 'Experience with Agile software development, for example Scrum or Kanban', 'Experience in advertising technology', 'Experience in collaborating with or managing data science teams.', 'Deep hands-on technical expertise', 'Familiarity with big data technologies']",0,0,0,0,0,0,0,0,0
175,b0d53390cb2034e7,"Senior Business Analyst, Decision Analytics Services (.Net Developer)",EXL,"Toronto, ON","[' Development of applications on .NET Technologies: C# .NET Core 1.0/2.0, .NET 3.5/4.5, ASP/ADO.Net, MVC , Programming Language: C#, C++, C, SQL, Scripting Languages Any : JavaScript, jQuery,SSIS/SSRS', ' Contribute to how analytical approach is structured for specification of analysis', ' Contribute insights from conclusions of analysis that integrate with initial hypothesis and business objective. Independently address complex problems', ' Participate in design of analysis and modeling approach with managers and modelers', ' Extremely comfortable working with data, including managing large number of data sources, analyzing data quality, and pro-actively working with client’s data/ IT teams to resolve issues', 'Master/ BA/ BS degree in mathematics, engineering, computer science or related areas is preferred', '\nSoftware (.NET Web API MVC) Developer :\n', '.NET Technologies: C# .NET Core 1.0/2.0, .NET 3.5/4.5, ASP/ADO.Net, MVC,,\n', 'Programming Language: C#, C++, C, SQL', '\nScripting Languages Any : JavaScript, jQuery,SSIS/SSRS\n', 'Access database, SQL server and SQL queries\n', 'Data Integration, OOPs concepts', '\nKnowledge of financial industry and solid communication skills', '\nEnd to end development experience', '\nEXL Analytics offers an exciting, fast paced and innovative environment, which brings together a group of sharp and entrepreneurial professionals who are eager to influence business decisions. From your very first day, you get an opportunity to work closely with highly experienced, world class analytics consultants.You can expect to learn many aspects of businesses that our clients engage in.\n', 'You will also learn effective teamwork and time-management skills - key aspects for personal and professional growth\n', 'Analytics requires different skill sets at different levels within the organization. At EXL Analytics, we invest heavily in training you in all aspects of analytics as well as in leading analytical tools and techniques.', '\nWe provide guidance/ coaching to every employee through our mentoring program wherein every junior level employee is assigned a senior level professional as advisors.', '\nSky is the limit for our team members. The unique experiences gathered at EXL Analytics sets the stage for further growth and development in our company and beyond.']",0,0,0,0,0,1,0,0,0
176,bd9571c392cdfecf,Product Compliance Electrical Engineer,SCIEX Danaher,"Concord, ON","['\nEnsure SCIEX’s adherence to Product Compliance based on corporate policy, international regulations and standards.', '\nGenerate Product Compliance test plans.', '\nGenerate data and reports relating to compliance for use in reporting SCIEX status to countries and regions.', '\nGenerate and update reports for new or existing products pertaining to product safety, electromagnetic compatibility, packaging and environmental compliance.', '\nTesting new or existing products or assemblies for compliance.', '\nSupport the operation of the compliance lab to ensure equipment and facilities are safe, compliant with procedures and operational.', '\nCreate Standard Operating Procedures on an as-needed basis.', '\nDevelop, modify, verify and validate of test methods as needed.', '\nPerform data analysis including test results and statements of conformity.', '\nSupport compliance projects on an as-needed basis.', '\nTake on DBS Initiatives in the spirit of continuous improvement.', '\nBachelor’s or Master’s Degree in Electrical/Mechanical/Mechatronics Engineering.', '\nExperience generating detailed engineering reports.', '\nKnowledge of international regulatory standards (e.g. CSA, CEN, IEC, UL) and their application.', '\nOver 2 years of experience in a design environment.', '\nExperience with product safety and/or EMI/EMC testing is an asset.', '\nFamiliarity with analytical instruments or medical device development is an asset.', '\nStrong project management skills to estimate, report status, and deliver individual assigned tasks.', '\nStrong self-starter.', '\nExperience working in an ISO 9001/17025/13485-based quality management system environment.', '\nProfessional Certification (PEO or OACETT)', '\nKnowledge of European and North American regulatory requirements (CE Marking, SCC, CEC, FCC, NEC, OSHA)', '\nKnowledge of Environmental Compliance regulations (RoHS, REACH, Prop 65, WEEE, etc.) is an asset.', '\nKnowledge of test equipment selection, functionality, operation, and calibration requirements', '\nFamiliarity with ISO 9001, ISO 13485 and ISO IEC 17025 quality system elements and operation', '\nStrong communication skills', '\nStrong knowledge of Microsoft Office suite', '\nWork well in a team environment']",0,0,0,0,0,0,0,0,0
177,cbc3415954f130f0,Senior Quality Assurance Engineer,Rubikloud Technologies,"Toronto, ON","['Solid understanding of software testing methodologies and processes in agile development environment.', 'Exceptional Experience in UI Testing, API Testing, Backend Testing and ability to build strong Integration test suite', 'Proven experience in building / maintaining an automation framework using selenium with Java( Intermediate to expert Level required)', 'Experience in writing complex SQL queries as well as creation of functions and stored procedures', 'Experience in Jenkins Integration and job management', 'Experience in Testing multiple data migration projects', 'Experience working with Azure, AWS and/or GCP.', 'Ability to work in *nix environments.', 'Strong communication skills, able to clearly communicate with multiple lines of business autonomously', 'Nice to have knowledge of data analytics and skills of verifying complex data mappings', 'Bachelor’s degree in Computer Science or equivalent program.', 'Retail Industry experience is a plus', 'Experience with Spark , Kubernetes, Python is a plus', 'Build, automate and maintain QA environments.', 'Review product requirements and identify gaps and conflicts with the existing system.', 'Develop testing strategy, Create Test plans, Develop test cases and build test harness/framework for our product.', 'Collaborate with Client Solutions Manager, Technical Product Manger, Data Scientists, Machine Learning Engineers, Developers and other QAs to standardize and enforce QA process and test coverage.', 'Proactively log defects and work with developers to troubleshoot and verify fixes.', 'Report quality status and escalate issues effectively.', 'Support Production Maintenance']",1,0,0,0,0,1,0,0,1
178,7ec893a56339038c,"Actuarial Analyst/Senior Actuarial Analyst, Personal Insurance Street Pricing",Aviva,"Markham, ON","['An open mind for new ideas and methodologies – you will develop predictive models for in depth analyses and improve current model/process. You will collaborate with Business Development partners on broker initiatives\n', 'A great team and collaborative work environment – You will collate all the analysis from the various centers of excellence to determine pricing proposals for rate changes. The team will work closely with the business and other Teams in Personal Insurance to deliver each region/channel’s mandate.\n', 'Advanced pricing and collaboration tools – You will research and apply both traditional and innovative ways to apply accepted actuarial techniques to business issues. You will develop actuarial pricing techniques that support the regions and provide pricing support for our personal insurance products\n', 'A culture of personal and professional development – You will prepare and support regulatory rate filings and document actuarial pricing process and models\n', 'Strong mathematical and statistical background\n', 'Strong problem solving and analytical skills\n', 'Proficiency in programming\n', 'Experience with MS Access, SAS and VBA is an asset\n', 'Bachelor degree in Actuarial Science, Math or Statistics\n', 'Minimum of 2 CAS exams\n', 'Minimum 1 years of P&C work experience\n', 'Focus on enhancing the customer experience\n']",0,0,0,1,1,0,0,0,0
179,f5c2c2b7ae5600b0,Innovation Manager (Concept Design)- Canada Goose Innovation Lab,Canada Goose,"Toronto, ON","['Identify opportunities for future innovation initiatives in the context of the overall Canada Goose Advanced Innovation MAP Roadmap\n', 'Conduct primary and secondary human insights research through existing methodologies including customer surveys, interview and wear testing protocols\n', 'Implement and facilitate innovation tools and frameworks to arrive at a defined innovation business case and brief\n', 'Be aware of future trends and cultural movements and link them back to CG.\n', 'Liaise and collaborate closely with cross-functional partners and key executive stakeholders to develop, establish and continually evolve our innovation portfolio\n', 'Leads and co-leads innovation projects at all stages of the innovation process to enable continual progress towards our delivery commitments\n', 'Synthesizes insights across sources and data points and transform them into key conclusions, compelling business stories, and strategic recommendations\n', 'Builds, presents and drives-forward innovation business cases which are defined by unique market opportunities in line with Canada Goose’s innovation agenda\n', 'Executes and manages timeline around delivery of proof-of-concept innovations including component and system testing in both laboratory and contextual environments (wear testing)\n', 'Drives proof-of-concept prototypes to commercialisation through in line partnerships and GTM (Go To Market) process\n', 'Identifies and works with relevant world-class vendors and consultants to accelerate our innovation agenda\n', 'Participate and present during Goose Advance Innovation Team (GAIT) quarterly updates when requested\n', 'Ability to Create graphic representation of proof-of-concept samples\n', 'Works with required creative partners to establish visual designs for innovation concepts\n', 'Ensures products are engineered to Canada Goose’s Quality and Production standards.\n', 'Provides feedback to Design on construction challenges and recommend alternatives or improvements.\n', 'Provides information of technical details to Product Developers as required.\n', 'Manages and create mock ups with advanced prototyping team in a timely manner when required.\n', 'Communicate and liaise with QA of key elements in design and construction.\n', 'Work closely with the Advanced Prototype Technician\n', 'Design or Industrial Design Education\n', 'Undergraduate degree required, advanced degree preferred\n', '5 years of professional experience in innovation-based role, ideally with a focus in project leadership on customer-driven design thinking, industrial design, product design/development, digital or graphic design\n', 'Experience in product-led brand, particularly in outerwear is an asset\n', 'Experience leading high-dynamic teams and cross-functional relationships across a face-paced business\n', 'Advanced knowledge of garment construction, pattern making, prototyping is an asset\n', 'Strong ability to work from scratch, from first prototype sample through to inline adoption\n', 'Clearly communicate with the inline Product Development and Engineering team to ensure successful handover and adoption to the inline collection, including accessibility for feedback and opportunities for key learnings.\n', 'Extended knowledge and interests in new construction methods and manufacturing technology\n', 'Experience with outerwear garments is an must\n', 'Should be organized, detail oriented, team player, multi-task oriented\n', 'Demonstrated ability to take initiative and work independently\n', 'Ability to prioritize day to day work activities according to the department/business needs and Goose Advanced Innovation Team deadlines and quarterly updates\n', 'Ability to work as a team and maintain a high level of professionalism and discretion\n', 'Excellent problem solving and decision-making skills.\n', 'Knowledge of Illustrator helpful\n', 'Able to work in a fast-paced environment while meeting the demands of many different departments (Production, Product Development, Cutting, Quality Assurance).\n', 'Consistently exhibits Canada Goose’s Values, taking pride in being innovative, respectful, passionate, accountable, and entrepreneurial while exhibiting personal commitment\n']",0,0,0,1,0,0,0,0,0
180,949795531d3d844f,Bilingual Inside Sales Specialist - (English and French),MT - Huntley Road,"Mississauga, ON","['\nWe help feed the world. We impact how food is produced, packaged and made safe.', '\nWe help keep you healthy.', '\nOur instruments make it possible for scientists to develop new drugs and bring life-saving medicines to the world.', '\nMettler Toledo products are important to the production and consistent quality of every kind of consumer product.', '\nNo matter how far human kind goes to explore new frontiers, Mettler Toledo is there to help make it happen.', '\nMeet and exceed sales quotas assigned to you', '\nExecute outbound sales campaigns', '\nEmploy professional selling skills to qualify, engage, follow-up and cross-sell', '\nNurture and work sales leads to develop and progress prospects to the next stage of the sales cycle', '\nQualify sales leads and obtain basic qualifying information', '\nAccurately quote and promote products, services, and solutions to small and medium accounts', '\nTrack, record, and update data ensuring database and reporting integrity Identify trends and make recommendations on alternative sales offers or approaches', '\nOffer straightforward technical advice and solutions to inquiring customers', '\nMedical, dental, prescription drug, and vision care coverage through Claimsecure, effective the first day of the month after 30 days of employment', '\nRetirement savings plan effective on the date of hire', '\nAnd, all the usual such as paid time off, flexible spending, short- and long-term disability, basic life insurance, business travel insurance, Employee Assistance Program, and domestic partner benefits', '\nGlobal market strength and worldwide leadership in weighing', '\nA brand name that is identified worldwide with precision, quality, and innovation', '\nThousands of patents, design and innovation awards', '\nA commitment to extraordinary service on our state-of-the-art equipment']",0,0,0,0,0,0,0,0,0
181,254e5484b6e9a743,Senior Cybersecurity Advisor,Institute for Clinical Evaluative Sciences,"Toronto, ON","['Conduct threat risk assessments on new product solutions in order to identify vulnerabilities prior to product release', 'Conduct penetration testing as part of the cybersecurity program on different environments', 'Conduct vulnerability assessments on different OS platforms, databases, mobile devices, and cloud and provide guidance to address existing vulnerabilities', 'Conduct internal cybersecurity audits, perform gap analysis and recommend corrective actions', 'Provide subject matter expertise for all cybersecurity related issues', ""Complete tasks designed to ensure cybersecurity of the organization's systems and information assets"", 'Provide technical expertise knowledge to monitor and respond to alerts generated from cybersecurity infrastructure equipment including anti-virus, firewall, IDS/IPS, VPN, SIEM, managed services, etc.', 'Conduct regular maintenance of the enterprise vulnerability management tool and program', 'Monitor cybersecurity related websites and stay up to date on current attacks and trends', 'Communicate issues/concerns to the manager, cybersecurity and the Information Technology department as necessary', 'Actively participate in maintaining the cybersecurity services process development and support', 'Other duties as may be assigned within the scope of this position.', 'Bachelor’s degree in a related field, and/or equivalent professional level work experience', 'Eight years of experience in cybersecurity', 'Minimum five years of experience in general network security', 'Solid understanding of network security methodologies, frameworks and technologies', 'Experience using Enterprise Vulnerability Management tools', 'Experience with Cybersecurity and Event Management (SIEM) tools', 'Experience with Incident Management and Incident response tools', 'Experience with both Unix/Linux and Windows environments (mandatory)', 'Experience with MSSQL, Oracle DB, and MySQL is a plus', 'Experience with Antivirus enterprise administration is a plus', 'Experience conducting penetration testing using open source tools', 'Experience with scripting languages such as Powershell, Python is a plus', 'Knowledge of Next Generation firewalls, Brocade Switches, Cisco Nexus and Virtual private networks', 'Knowledge of VMware, Citrix XenApp and Citrix NetScaler', 'Knowledge of Active Directory, Microsoft Exchange and storage systems', 'Knowledge of Microsoft Azure security features, Office 365 security', 'Knowledge of backup infrastructure', 'Excellent problem solving techniques and listening skills', 'Excellent verbal, written, analytical, and interpersonal skills', 'Ability to work independently and as part of a team', 'Flexibility and ability to work under pressure to manage multiple competing priorities within tight deadlines', 'Ability to work effectively and collaboratively with internal staff, scientists, external partners and stakeholders.']",1,0,0,1,0,1,0,0,0
182,a1b278489be01152,Staff Engineer - Machine Learning and Machine Intelligence for Robotics,MDA Corporation,"Brampton, ON","['Co-develop mission and operations process flow from the outset of mission planning, through on-orbit operation, to post-flight analysis, identifying at each stage the inputs, outputs, needed stakeholder approvals, duration, and effort\n', 'Identify aspects of the Mission Operations Process which offer the promise of significant improvements in duration, effort, and resource allocation, both through the use of AI and other optimization methods\n', 'Explore partnerships with SMEs and universities to validate potential developments in AI and determine potential near- and medium-term R&D collaboration project efforts\n', 'Develop an R&D Roadmap for AI-based developments to address short-, medium-, and long-term Mission Operations Process improvements\n', 'Lead/execute initial seedling projects addressing early roadmap activity to explore the potential viability and potential of proposed ideas\n', 'Engage MDA’s key stakeholders (internal and external – e.g., CSA, government of Canada, federal and provincial funding agencies – on the value proposition for AI-enabled Space Robotics Mission Operations\n']",0,0,0,0,0,0,0,0,0
183,df837edf24fff450,Staff Engineer - Machine Learning and Machine Intelligence for Robotics,Maxar Technologies,"Brampton, ON","['Co-develop mission and operations process flow from the outset of mission planning, through on-orbit operation, to post-flight analysis, identifying at each stage the inputs, outputs, needed stakeholder approvals, duration, and effort\n', 'Identify aspects of the Mission Operations Process which offer the promise of significant improvements in duration, effort, and resource allocation, both through the use of AI and other optimization methods\n', 'Explore partnerships with SMEs and universities to validate potential developments in AI and determine potential near- and medium-term R&D collaboration project efforts\n', 'Develop an R&D Roadmap for AI-based developments to address short-, medium-, and long-term Mission Operations Process improvements\n', 'Lead/execute initial seedling projects addressing early roadmap activity to explore the potential viability and potential of proposed ideas\n', 'Engage MDA’s key stakeholders (internal and external – e.g., CSA, government of Canada, federal and provincial funding agencies – on the value proposition for AI-enabled Space Robotics Mission Operations\n']",0,0,0,0,0,0,0,0,0
