,Job_ID,Job_Title,Company_Name,Location,Job_Description,Python,R ,Matlab,Excel,SAS,SQL,SPSS,Hadoop,Spark
63,9dfc818c7f3bc743,Senior Data Scientist,WW International (formerly Weight Watchers),"Toronto, ON","['\nPartner with stakeholders across the organization to identify high-impact opportunities to leverage our extensive data to better serve our members.', '\nDevelop predictive and other machine-learned models to enhance and optimize user engagement and experience.', '\nPerform exploratory and targeted analyses to understand the data, the problem, and to generate insights, such as novel features, that can be fed into our models.', '\nWork with the rest of the team, and with our consumers and partners in dev and product, to implement and ship production-level code.', '\nExplore and assess utility and potential of additional data sources, APIs, and methods (spanning areas such as statistics, deep learning, and natural language processing).', '\nMotivate and mentor other data scientists to grow their skills and careers.', '\nPeer review other data scientists’ contributions.', '\n3+ years of experience building and implementing machine-learned models in industry, ideally dealing with problems relevant to behavior change, community, product, and/or marketing.', '\nAbility to scope and (self-)manage machine learning modeling projects.', '\nAdvanced Degree (Ph.D./MS) in data science, statistics, or a related quantitative discipline.', '\nExperience with advanced modeling techniques, such as collaborative filtering and content-based recommenders, matrix factorization, time series analysis, classifiers, natural language processing, and ensemble methods.\n', 'Experience in deep learning for images or text (fast.ai, PyTorch, Tensorflow)', '\nExpert knowledge of Python and SQL, or similar industry standard tools used for large-scale data analysis and modeling (e.g. sklearn, gensim, pandas).', '\nExperience with Google Cloud Platform (Dataflow, Beam, BigQuery) and other big data technologies a plus.', '\nRecent experience with a digital company a plus.', '\nMentor other data scientists', '\nSelf-motivated, results oriented, enthusiastic, and a creative thinker.', 'Competitive compensation and profit sharing plan', '\nTuition reimbursement and online courses to help you reach your career aspirations', '\nCommuter benefits', '\nYearly well-being allowance for your physical, financial, social and emotional well-being', '\nFree WW membership for you plus 3 free WW memberships for your friends and 3 for your family', '\nFree fruit, snacks and coffee to get you through your day', '\nSummer Fridays, happy hours, and company outings']",1,0,0,0,0,1,0,0,0
64,64479af2d2bb8fde,Data Engineer (multiple roles) - Markham,Opta Information Intelligence Corp.,"Markham, ON","['Degree in Computer Science, Mathematics or any Quantitative discipline\n', '3 to 5+ years’ experience in Data Engineering or Data Based Projects\n', 'Forward-thinking approach and successful history in driving their company’s use of advanced data systems and automated processes leading to continuous business improvement\n', 'MS TSQL or similar – familiarity with stored procedure, function, and trigger programming\n', 'PostgreSQL\n', 'Python, Pandas, Numpy\n', 'Familiarity with “Big Data” frameworks and experience with AWS (EC2,S3,Lambda)\n', 'A strong communicator with the ability to explain complex technical subject matter to non-technical people\n', 'Strong professional ethics and impeccable personal integrity\n', 'Graph DB\n', 'Meta Data experience']",1,0,0,0,0,1,0,0,0
65,a07b3b7351356eb9,Senior Data Analyst,Toromont Industries Ltd.,"Concord, ON","['Demonstrate safe, environmentally sound and healthy work behaviours at all times in support of Toromont’s Health and Safety Policies, Programs and initiatives\n', 'Clean data by working with IT and end users to manage sources and tech accuracy where possible, and replace bad data with best predictions for analytical purposes', '\nPerform business analysis such as, statistical analysis, data mining and wrangling, data visualization and insights generation', '\nShare insights with stakeholders, generating automated reports and aligning business stakeholder needs with Marketing’s capabilities and vision', '\nElicit requirements from business owners and users (aligning business stakeholder needs with Marketing’s capabilities and vision) and determine how to configure the solution to best meet their needs', '\nAssist with building predictive analytics models and algorithms to support business objectives', '\nDeliver technical training modules of CRM pilot modules and PowerBI dynamic reports to end users and management', '\nSupport on other tasks required within the department', 'Graduated from a Post-Secondary Business, Engineering, or Computer Science Program', '\nSafety conscious with a solid understanding of business processes', '\nExceptional communication and interpersonal skills to maintain and build strong relationships across functional teams', '\nFamiliarity using SQL for data extraction\n', 'Ability to couple subject matter expertise with strong statistical skills', '\nExcellent interpersonal skills, especially when communicating with non-technical teams', '\nExtensive experience with PowerBi or Tableau, R or Python would be an asset', '\nHighly organized with excellent time management skills and high attention to detail', '\nMindset for continuous improvement and customer centric with strong follow up', '\nAbility to effectively prioritize and adapt in a fast-paced environment with multiple tasks and deadlines', '\nProfessional, self-motivated, independent and a team player with a sense of urgency\n', 'Willing and able to work flexible hours in support of the business needs']",1,1,0,1,0,1,0,0,0
66,5fb3b050871968a4,Wireless Engineering Data Scientist,TELUS Communications,"Toronto, ON","['Strong interest and passion for learning new data science tools and techniques (Artificial Intelligence/Machine Learning)', 'Passion for building web based tools and applications', 'Willingness to independently develop automation pipelines, web applications and visualizations within a collaborative data science driven team', 'Explore datasets and use AI/ML techniques to find new insights', 'Develop data pipelines to efficiently extract insights', 'Apply your creativity to design, build and deploy web applications that will enable our data scientists to visualize, troubleshoot and analyze service experience on the network', 'Develop novel visualizations using web-frameworks and data science libraries', 'Interested in applying machine learning and data science techniques, e.g. Deep learning, time series predictions, clustering algorithms, etc', 'Experience with front-end development (JavaScript, React, CSS)', 'Experience in backend and API development (Node.js, microservices)', 'Willingness to learn React and Redux', 'Solid understanding of databases and big data, including: MySQL, NoSQL databases (e.g. MongoDB, Splunk, Cassandra & Hadoop)', 'Data visualization using custom frameworks (e.g. D3.js, MapD) and Tableau', 'Understanding of GIS technology (e.g. MapInfo, ArcGIS)', 'Bachelor’s degree in Electrical Engineering', 'Basic understanding of 3GPP (5G/LTE/UMTS/HSPA) radio access network design, optimization and capacity engineering', 'Real time streaming analytics such as Spark\n', 'Computer vision techniques (e.g. CNN)']",0,0,0,0,0,1,0,1,1
67,a2bd783dd8f2045d,"Lead Data Scientist 3, Words with Friends",Zynga,"Toronto, ON","['\nWork with large amounts of data to find opportunities to improve the experience that Zynga provides to its players', '\nDefine analytics and data science roadmap, balancing actionable insights to substantially improve core game metrics', '\nDrive and empower game studio to make quantitatively informed, evidence based decisions', '\nWork closely with game team to design, test, verify and implement machine learning models with Zynga’s games that impact millions of users', '\nDesign and evaluate novel scalable approaches to experimentation', '\nBS in Computer Science, Math, Statistics, Economics, or other quantitative field; Masters, MBA or PhD preferred', '\n5+ years of work experience in data science or analytics roles', '\nFluent in SQL; Strong experience with programming in Python and/or R; Adept in at least one visualization tool such as Tableau, or QlikView', '\nDemonstrated experience with some or all of the following: statistics, experimental design, machine learning, data mining, predictive modeling, deep learning', '\nExperience in analyzing large datasets, preferably in a Hadoop or Spark environment, and deploying production-ready systems at scale', '\nStrong written and oral communication skills', '\nAbility to work effectively in a fast-paced environment with changing priorities', '\nAbility to collaborate effectively with engineers, product managers, analysts, and marketing to deliver unambiguous business impact', '\nStrong passion for gaming!', '\nZynga Stock RSUs and Bonus Plan', '\nFull medical, dental, vision benefits as well as life insurance', '\nCatered lunch daily', '\nGenerous Paid Maternity/Paternity leave', '\nOpen vacation policy for many employees', '\nFlexible working hours on many teams', '\nCasual dress every single day', '\nWork with cool people!']",1,0,0,0,0,1,0,1,1
68,b9b835c58cd42fe5,"Research Scientist, Alexa NLU","AMZN CAN Fulfillment Svcs, ULC","Toronto, ON","[""Master's degree in Computer Science, Computational Linguistics, Engineering, or related technical field"", '3+ years industry experience with data mining and analytics techniques', '3+ years industry experience in programming in R, Python, SAS or similar languages', 'Help drive the ML models and technology choices that enable a world-class user experience', 'Utilize various metric sources to deliver rapid iterations of models', 'Propose new modeling solutions and run experiments to prove their efficacy', 'Collaborate with colleagues from science, engineering, and business backgrounds,', 'Ensure data quality throughout all stages of acquisition and processing, including such areas as data sourcing/collection', 'PhD degree in Computational Linguistics, Engineering, Statistics or related field', '5+ years experience in data scientist, analyst or NLP specialist role with a large technology company', 'Experience in two or more of these or similar Natural Language Processing topics: word categorization and tagging, syntactic parsing, word sense disambiguation, topic modeling; contextual text mining, application of machine learning to NLP, semantic similarity, phrasal semantic analysis, text matching and similarity, word embedding, lexicon normalization, named entity recognition', 'Excellent communication, analytical and collaborative problem-solving skills', 'Demonstrable track record dealing well with ambiguity, prioritizing needs, and delivering results in an agile, dynamic environment', 'Experience collaborating with software development teams, data scientists, business intelligence or other technical roles']",1,0,0,1,1,0,0,0,0
69,3a00bf93fdeb2010,Data Engineer - Wattpad Labs,Wattpad,"Toronto, ON","['\nShip and maintain machine learning models in production', '\nImplement scalable, robust ETL/ELT data pipelines', '\nDesign, build, maintain, and evolve a large scale distributed system serving millions of people per day', '\nWork collaboratively with product management and data scientists', '\nContribute towards continuous improvement across data and engineering department', '\nSolid understanding of data engineering best practices (batch data processing, streaming, etc.)', '\nUnderstanding of software engineering fundamentals and principles', '\nFamiliarity with data engineering tools; and proficiency with at least one: ElasticSearch, Spark, Airflow, Luigi, Hive', '\nProficiency with cloud technologies (AWS, EMR, ECR)', '\nProficiency in Python, SQL, and *nix environments', '\nYou are eager and take initiative, you leave the campgrounds cleaner than you found it', '\n3+ years of related industry experience', '\nInterest in natural language processing and understanding', '\nCompetitive salary', '\nMeaningful equity (stock options)', '\nCareer development; we believe in mentorship and supporting you to achieve your goals', '\nHackathons', '\nHealth benefits, fully covered on us!', '\nGenerous parental leave top-up', '\nTransit pass, choice of hardware, flexible hours', '\nCorporate discount for gym memberships for you and your family', '\nA beautiful office in downtown Toronto, with easy access to transit', '\nAnd a whole lot more!']",1,0,0,0,0,1,0,0,1
70,bbdc888d7c2b6134,Data Engineer,ASSURANCE,"Toronto, ON","['\nExpertise in modeling data', '\nExperience with Spark, Hadoop/EMR, SQL', '\nAbility to optimize data access for speed/reliability/velocity as needed by the business', '\nComfort with QA’ing your own data, to include ‘menial tasks’ like listening to calls or scrubbing excel files to ensure everything is correct', '\nComfort with learning new technologies to help the team explore new solutions to existing problems', '\nA drive to move fast and deliver business value', '\nExcellent communication ability – you can explain your work in a way that anyone on the team can understand, and you can frame problems in a way that ensures the right question is being asked.', '\nBusiness Acumen – you are always eager to understand how the business works, and more specifically, how your work impacts the business.', '\nEnthusiastic yet humble – you are excited about the work you do, but you are also humble enough to embrace feedback – you don’t need to be the smartest person in the room.', 'Capable of modifying an existing job to add a new field and get it into production within a day.', '\nCapable of creating a new data pipeline/job within 2-3 days.']",0,0,0,1,0,1,0,1,1
71,0771eaacf4968c0e,Machine Learning Scientist,TD Bank,"Toronto, ON","['\nJoin a world-class team of machine learning researchers with an extensive track record in both academia and industry.', '\nResearch, develop, and apply new techniques in the intersection of deep learning and personalization to further advance our industry leading product.', '\nWork with diverse real-life datasets that range from banking transactions, to predictive health applications, to audio/video consumption.', '\nCollaborate closely with the engineering team in a fast paced startup environment and see your research deployed in production with very short turnaround.', '\nPhD degree in Computer Science, Statistics, Operations Research, Mathematics or related field.', '\nStrong background in machine learning.', '\n5+ years of research experience with publication record.', '\nProven track record of applying machine learning to solve real-world problems.', '\nExperience with deep learning and/or collaborative filtering.', '\nHands on experience in software systems development and SaaS applications.', '\nExperience with one or more Java, Matlab, Scala, Tensorflow and MXNet', '\nExperience using GPUs for accelerated deep learning training', '\nFamiliarity with AWS', '\nEntrepreneurial and inclusive culture', '\nExcellent health coverage', '\nFour weeks paid vacation', '\nCatered lunches twice a week over machine learning talks', '\nOpportunities to collaborate with faculty at the Vector Institute']",0,0,1,1,0,0,0,0,0
72,2ebff5b16893243b,Medical Scientist,AstraZeneca,"Mississauga, ON","['\nYou may coordinate the activity of a research team and you will hold full accountability for projects with Global impact', '\nYou will build key relationships internally with clinical project teams, and externally with regulatory bodies and external service providers', '\nYou will ensure there is adequate input into the drug development process from colleagues in each of the various areas of drug development, or provide input into one or more of these areas as a technical expert', '\nYou will develop and design studies to determine the scientific and clinical viability of a particular drug or portfolio of drugs and interpret the results of these studies, either as the head of a team, or by providing expert input', '\nYou will participate in protocol design, writing and implementation to meet GCP, ICH and all AZ quality standards', '\nYou will manage cross functional projects to ensure the successful passage of drugs through all development phases, or assist with various elements of such a project as a clinical expert', '\nYou will review and interpret medical data and clinical trial data and come up with conclusions', '\nYou will also have responsibility for delivery of pieces of the trials and may lead submissions from a process standpoint', '\nPhD in a scientific field, PharmD or MD is required', '\nOncology clinical trials experience', '\nExperience managing and interpreting clinical trials results as well as exposure to writing protocols', '\nStrong analytical skills', '\nExperience of authoring scientific documents', '\nWell-developed communication skills', '\nSufficient technical and disease area knowledge to be able to interact with confidence with internal and external organizations', '\nConsiderable relevant experience in the pharmaceutical industry is preferred, however academic experience will be considered', '\nExperience across phases II - III drug development', '\nGTAA Top Employer Award for 5 years: https://content.eluta.ca/top-employer-astrazeneca-canada', '\nBest Workplace Culture Award at the 2018 Canadian HR Awards: https://www.linkedin.com/pulse/thriving-best-workplace-culture-gena-restivo/', '\nLearn more about our Global Careers: https://www.youtube.com/user/AstrazenecaCareers']",0,1,0,0,0,0,0,0,0
73,f38705ce36e8b0dc,Data Engineer,Glu Mobile,"Toronto, ON","['Maintaining, streamlining and hardening existing data pipelines, from ingestion, through ETL and batch processing in order to reliably process billions of records per day.\n', 'Build data support for our personalization and experimentation efforts, solving problems from statistical test automation to building real-time M/L applications.\n', 'Working with Analytics and Product Management to ensure optimal data design and efficiency.', '\n Assisting Data Analysts and Data Scientists with pipeline and model deployment', ""Bachelor's degree in computer science/mathematics/engineering, or other fields with proven engineering experience.\n"", 'More than 3 years of software engineering experience, especially working on back-end data infrastructure.\n', 'Proficiency with at least one of the following languages: Java, Python, Scala.\n', 'Proficiency with Spark and/or similar tools in Hadoop/YARN environment and comfortable with Linux operating system.', '\nProficiency with SQL and SQL-like languages, especially Hive.\n', 'Experience with AWS Ecosystem, especially Kinesis, EMR, Lambda, and Glue.', 'Experience with high-scale machine learning, I.e. Spark M/L, Sagemaker, etc.\n', 'Knowledge of NoSQL application data stores i.e. Druid, HBase, Cassandra, DynamoDB, Redis.']",1,0,0,0,0,1,0,1,1
74,a1bbda0dd5a35407,Mobile Network Data Scientist (Design Specialist/Engineer),TELUS Communications,"Toronto, ON","['Apply your data exploration and manipulation skills to store wireless network data into a useful layout (via ETL, map-reduce, cleanse, feature engineer, etc.). Implement data collection, and storage architectures to support our big data initiatives and data-driven insights.', 'Apply your data analytics skills in order to perform proof of concepts/prototyping and gain insights from the data (via machine learning, computational statistical analysis, etc.). Create wireless optimization models, platforms and insights for the engineering stakeholders. Bring the science of optimizing a wireless network to new levels.', 'Apply your data presentation skills in order to make insights available in meaningful ways to key stakeholders (via API, Tableau, web apps, etc.). Understand RF engineering requirements and provide data analytics and web applications to support their work.', 'Provide expertise in software engineering best practices, insights and guidelines to promote sustainable innovation. Keep up-to-date with data science and wireless technologies.', 'Acknowledged for your 3+ years of software development experience', 'Valued for your strong problem solving, big data analytical and mathematical skills', 'Commended for your passion for automation, data science and machine learning', 'Recognized for your experience with database design and development: MySQL, SQL Server, Oracle, Hadoop, SPLUNK, Alteryx, Tableau', 'Skilled in some of the following languages: C++, Java, Structured Query Language (SQL), Python, R, Hypertext Markup Language (HTML), Extensible Markup Language (XML) & JavaScript Object Notation (JSON)', 'Regarded for your experience with JavaScript frameworks like JQuery, AngularJS, React or others', 'With a Bachelor’s degree in Computer Science or Engineering', 'Full stack software development experience', '2+ years of experience in the telecom industry for basic understanding of wireless network KPIs, mobile telecommunications technologies, HSPA/LTE/5G', 'Master’s degree in Computer Science or Engineering']",1,0,0,0,0,1,0,1,0
75,20a74eaf3a50dcf7,Data Engineer,Tucows,"Toronto, ON","['\nCreate large-scale batch and real-time scalable data pipelines (ETL/ELT).', '\nWrite complex queries on large, heterogeneous data sets, make it easily accessible, and optimize the performance of our data platform.', '\nPerform Data wrangling to transform and map data from raw data forms into formats more appropriate and valuable for analytics', '\nContinuously optimize testing and tooling to improve data quality.', '\nEmploy best-practices practices in continuous integration and delivery.', '\nWork with other engineers to evolve our Data Tech Stack.', '\nWork in cross-functional, agile teams that include Product Managers, Data Analysts, and Data Scientists.', '\nHave substantive software engineering experience and a proven track record of writing elegant, maintainable, self-documenting code in languages like Scala and Python.', '\nYou have years of experience creating reliable data pipelines, combining and transforming data from sources to consumption, and architecting data stores.', '\nYou have experience with one or more data processing frameworks.', '\nHave hands on experience with schema design, data modeling, and data storage techniques.', '\nYou have superior SQL skills and are familiar with SQL-like languages.', '\nHave experience with open source RDBMSes, No-SQL, messaging, and event streaming platforms, like Postgres, Cassandra, RabbitMQ, and Kafka.', '\nYou know, and can demonstrate, the value of agile processes, continuous integration, and continuous delivery.', '\nYou have excellent written and verbal communication skills.', '\nYou love to collaborate, are a good team player, an excellent listener, and are fun to work with.', '\nHave experience with cloud data technologies.', '\nSomeone with wholesale or retail domain experience.', '\nA person who’s worked for an ISP.', '\nSomeone that’s familiar with telcos, especially MVNOs.']",1,0,0,1,0,1,0,0,0
76,4084f1821878e3ab,R & D Scientist Pharmaceutical,SGS Canada,"Mississauga, ON","['Perform the development and validation of analytical testing procedures for drug substances and drug products\n', 'Write protocols, drafts methods and technical reports for the Research and Development department and clients', 'Executes experiments, following the company’s Standard Operating Procedures, Deviations and Change Control programs and cGMP guidelines.', 'Keep all records and lab notebooks in good order. Analyze testing data, enter the testing results into the company’s electronic system for a certificate of analysis and prepare reports, if required, in timely manner.', 'Write and Review technical data, documents, SOPs and proposals as required.', 'Coordinate method transfers between clients, the Research and Development group, and the RM/Finished Products departments', 'Assist in the failure investigations within other SGS groups and design investigation protocols and suggest corrective actions.', 'In case of a testing failure, immediately report to the Department Head or the designee before proceeding further with the test, lead/assist failure investigations to identify the cause of failure and prepare a deviation report and/or Corrective Preventative Actions (CAPA) if it is appropriate.', 'Ensure that work order documentation is complete in every respect and all results are entered into the Electronic Laboratory Information System or client’s Certificate of Analysis before submission to the QA reviewer.', 'Participate in training sessions in the proposal, investigation and introduction of new technologies and services for SGS', 'Ensure that equipment is maintained properly. Also perform calibrations and qualifications as required.\n', 'Oversee, train, mentor and guide Analysts/Scientists in their work', 'Perform other assigned lab duties as requested.', 'Education: MSc/PhD', 'Experience: 5+ years with demonstrated ability to complete more complex role/duties as mentioned above.', 'Must be proficient in using various types of computer software (Word, Excel. PowerPoint & Outlook).', 'Proven ability to manage and coordinate multiple projects in a fast-paced, highly professional environment.', 'Demonstrates excellent verbal and written communication skills.', 'Ability to work well with others & independently.\n', 'Proven time management skills and a strong attention to detail.']",0,0,0,1,0,0,0,0,0
