,Job_ID,Job_Title,Company_Name,Location,Job_Description,Python,R ,Matlab,Excel,SAS,SQL,SPSS,Hadoop,Spark
120,b8d07b7235254e1d,Data Architect Lead,Accenture,"Toronto, ON","[' Defining the structure of an organization’s logical and physical data assets and data management resources.', ' Defining and aligning the major types and sources of data necessary to support the Business.', ' Defining data entities relevant to the enterprise.', ' Defining the analytics vision & strategies, redefining the operating model & talent strategy, managing the change journey and/or playing serving as the “architect” to design and scale end to end analytics transformation.', ' Defining and aligning the major types and sources of data necessary to support the business and determining how it is used, stored, managed and integrated within the organization’s IT systems and applications.', ' Design analytics architectures, including AIP and Big Data platforms, bridging from analytics strategy to enablement.', ' Experienced in Data Storage Tools & Techniques, Data Archiving Patterns & Techniques, Cloud Backup Architecture and Design, Data Warehouse Tools, Data Conversion & Migration, Master Data Management, Metadata Management, Network Data Management Protocol (NDMP), Informatica MDM, Data Management and Integration, Systems Development Lifecycle (SDLC), Data Modeling Techniques and Methodologies, Database Management, Database Technical Design and Build, Extract Transform & Load (ETL) Tools, Cloud Data Architecture, Data Architecture Principles, SAS DataFlux ETL Tools, Online Analytical Processing (OLAP), Data Processes, Data Architecture Principles, Data Architecture Estimation', ' 5 to 7 years working as a consultant or directly with clients for eg. conferring with customer to capture user requirements, conduct user reviews and run stakeholder agreement meetings, understanding and translating customer needs into business and technology solutions, providing consultation on the customer data architecture journey and data driven digital transformation', ' 5 to 7 years performing ETL and data conversion, facilitating Data cleansing and enrichment through data de-duplication and construction', ' 5 to 7 years performing ad-hoc Data extraction and archival; Managing Data life-cycle.', ' Expertise in using Hadoop, MapReduce, Spark, Pig, Hive technologies, Data Ingestion in Data Lake, Data Storage on key Cloud providers (AWS, Azure, GCP), Redshift, Data Retrieval on Big Data platforms and Interfacing Data Science and Data Visualization tools on Big Data platforms', ' Experience in Data Modeling, Big Data Platforms (e.g. Cloudera, Hortonworks, AWS, Talend, etc.), Data Migration and Quality (using ETL e.g Informatica), MySQL/NoSQL, CQRS Event Sourcing']",0,0,0,0,1,1,0,1,1
121,3eb7d9f38392b65c,ICPMS Analytical Chemist,Entegris,"Toronto, ON","['Performs trace metal analysis on Raw material, manufactured materials, and in-process samples when needed and in timely manner;', '\nDevelopes ICPMS methods drives for continuous improvement of existing testing methods;', '\nUses proper controls for analytical instrumentation, validates and verifies methods/data and takes corrective action when necessary', '\nMaintains instrumentation and performs procedures for product testing purposes;', '\nManages ICPMS and clean room supplies and monitors health of clean room and Utra Pure DI-water system quality;', '\nConducts other analysis techniques as defined by existing work instructions on raw materials and finished goods to ensure QC;', '\nWorks on cross-functional teams as analytical subject matter expert;', 'Bsc, Msc or PhD in analytical chemistry is required;\n', 'Minimum 3 years of work experience with ICPMS representing 50% of workload or Ph.D. in this area.', '\nICPMS experience is a must, working experience with Perkin Elmer ICPMS is a plus;', '\nThe candidate must possess advanced technical knowledge in multiple ICP-MS analytical sample preparation techniques (dry ashing, open and closed vessel wet oxidation, and microwave assisted digestion for ICP/MS analysis), instrumentation, and analysis;\n', 'Additional General lab instrument (HPLC, IC, GC, GC-MS,etc.) operations and maintenance experience preferred;', '\nStrong ability to understand mathematical concepts related to laboratory data interpretation and familiar with MSA including Gage R&R', '\nAbility to troubleshoot instrument or analytical problems;', '\nKnowledge of proper safe handling/disposal of chemicals and ability to maintain a clean and safe workspace to complete lab work safely;', '\nStrong Independent operation and problem-solving abilities and must be highly motivated and self-directed;', '\nExcellent writing and communication skills;', '\nBasic computer knowledge, including MS Office; LIMS experience preferred;', '\nExperience with QA/QC protocol preferably ISO 17025;', '\nAbility to occasionally travel internationally;', 'Having willingness to learn Strong communication skills with proven capability to advance multiple work tasks towards successful and timely outcomes.', '\nProductivity on Tests and analysis of R&D samples, manufactured materials, and in-process samples when needed and in timely manner;', '\nPerformance on having very active and strong ICPMS metrology Lab and ecexuting ISO17025 requirements;', '\nAbility to learn and become proficient at several analytical techniques;', '\nEnabling quality initiatives as they relate to the customer, corporate objectives, quality planning, the quality policy, process improvement and new business goals and objectives. Communicates with other functional groups, suppliers and other resources in order to achieve these objectives;\n', 'Confering with production and development scientists regarding results and research, preparing technical reports and presentations to promote learning;', '\nAbility to work in a cross-cultural and cross-language team environment;']",0,1,0,1,0,0,0,0,0
122,2baafb4b10dcd717,"Research Associate, MRI",Sunnybrook Health Sciences Centre,"Toronto, ON","['Develop radio-frequency hardware for human brain MRI and other imaging modalities to be integrated with human brain MRI, including applications of said hardware', 'Work with clinical and industrial collaborators in cooperation with the Senior Scientist. Collect and analyze data for collaborative projects', 'Manage the daily operations of the lab with minimal supervision', 'Participate heavily in abstract, poster, paper, and grant preparation', 'Provide direct supervision for assigned junior lab members, including postdoctoral research fellows and students.', 'Provide leadership within the research group on technical matters', 'D. in electrical engineering, biomedical engineering, physics, or mathematics', 'Minimum 3 years experience in MRI radio-frequency hardware development', 'Minimum 2 years post-doctoral fellowship experience', 'A track record of international peer-reviewed journal publication', 'Experience working in a biomedical research environment.', 'Well-developed interpersonal skills: ability to listen and communicate, as needed to foster a team approach to research', 'Able to set priorities successfully, and coordinate work flow around grant deadlines and grant applications', 'Excellent communication skills']",0,0,0,1,0,0,0,0,0
123,316b00c49dcb4f5e,"Director, People & Culture",BlueDot Inc,"Toronto, ON","['Recruitment & Onboarding: Leading full-cycle recruitment, selection, and onboarding to ensure BlueDot continues to attract and hire top talent while providing an exceptional candidate experience\n\n', 'Performance management: Re-designing and relaunching our company-wide performance management & feedback process\n\n', 'Training and development: Designing training, mentorship, and development processes to allow all employees to grow in their roles and careers at BlueDot\n\n', 'Policies and Compliance: Developing and administering HR policies and programs to ensure BlueDot is not only compliant with employment legislation, but supporting the evolving employee and business needs\n\n', 'Employee Relations: Providing proactive and specialized employee relations advice and consultation to leaders to build and maintain a high performing and engaged team\n\n', 'Organizational Change: Supporting leaders with workforce planning and the implementation and communication of organizational changes', 'Continually identifying and implementing opportunities to improve employee experience, wellbeing, and happiness', 'Planning and organizing celebrations and events (out of office summer and holiday events, monthly social nights, product launches, recognizing milestone life events, etc.)', 'Soliciting employee feedback through quarterly surveys and bi-annual one-on-one meetings to inform and evolve our People & Culture strategy', 'Developing and implementing employee recognition programs', 'Managing and administering the culture budget', 'Ensuring the physical office space supports a welcoming, collaborative, and productive working environment\n\n', '10+ years of People/HR experience including in strategic and leadership roles\n\n', 'Bachelor or Master’s degree in business management, human resources, organizational development, or a combination of these or other relevant fields. HR Certification would be an asset\n\n', 'A natural entrepreneurial style which is more aligned to “can do” than being policy-focused\n\n', 'Experience leading and scaling people and culture programs in a growing organization\n\n', 'Expert consulting skills with the ability to build collaborative, trustworthy relationships at the most senior levels in an organization\n\n', 'Strong business acumen and thrives in a start-up environment and working in “the grey”\n\n', 'Excellent presentation, facilitation, and communication skills to both internal and external audiences\n\n', 'A proven ability to drive change and influence adoption of new ideas in a scaling organization\n\n', 'Demonstrated knowledge and understanding of employment legislation and compliance requirements, HR policies and best practices\n\n', 'An innate passion for talent, culture, and engagement practices\n\n', 'Strong analytical and problem solving skills with the ability to understand trends and develop recommendations\n\n', 'Meaningful work that has purpose', 'Being a part of a fun and collaborative team', 'Outstanding health & dental benefits', 'Healthy office snacks', 'Downtown office with beautiful lake views, minutes from Union station']",0,1,0,1,0,0,0,0,0
124,a93bcf06f722a6c0,"Research Scientist, Alexa Speech","AMZN CAN Fulfillment Svcs, ULC","Toronto, ON","['Participate in the design, development, evaluation, deployment and updating of data-driven models and analytical solutions for machine learning (ML) and/or natural language (NL) applications.', 'Develop and/or apply statistical modeling techniques (e.g. Bayesian models and deep neural networks), optimization methods, and other ML techniques to different applications in business and engineering.', 'Routinely build and deploy ML models on available data.', 'Research and implement novel ML and statistical approaches to add value to the business. Mentor junior engineers and scientists.', 'PhD in Electrical Engineering, Computer Sciences, or Mathematics with specialization in speech recognition, natural language processing, or machine learning.', 'Experience in building speech recognition and natural language processing systems (e.g. commercial speech products or government speech projects)', 'Solid Machine Learning background and familiar with standard speech and machine learning techniques.', 'Proficient in neural network and/or deep learning are pluses.', 'Scientific thinking and the ability to invent, a track record of thought leadership and contributions that have advanced the field', 'Solid software development experience', 'Good written and spoken communication skills.']",0,0,0,0,0,0,0,0,0
125,12a1d36746773a70,Senior Project Manager,University of Toronto,"Toronto, ON","['\nDeveloping projects and policies of importance that require a rigorous approach and attention to very fine detail', '\nDesigning, pre-testing and formatting surveys, interviews and other research data collection tools', '\nDetermining qualitative and/or quantitative research methods according to research objectives', '\nCoding quantitative research data and producing complex statistical information', '\nResearching, analyzing and recommending grant opportunities and writing grant applications', '\nConducting systematic literature reviews and critical appraisal of research literature', '\nDelivering presentations at conferences on research findings', '\nDirecting the activities of a single ongoing staff-appointed employee', ""\nMaster's Degree or acceptable combination of equivalent experience"", '\nMinimum four years related experience in a research environment, supporting quantitative and qualitative research projects', '\nKnowledge of the Faculty of Medicine and its hospital affiliations', '\nSignificant experience in research methodology and design, including extensive experience designing and analyzing surveys', '\nDemonstrated experience leading multiple, concurrent research projects', '\nExperience supporting and advising senior-level committees', '\nExperience identifying grant opportunities and preparing grant applications', '\nExperience directing and supervising staff', '\nStrong technical knowledge and application of MS Office Suite, particularly MS Excel and MS PowerPoint', '\nDemonstrated technical experience using SPSS and Tableau data visualization software', '\nProgramming skills in SPSS syntax, VBA, or SQL', '\nSuperior communication, interpersonal, leadership and problem solving skills', '\nStrong oral presentation and delivery skills', '\nHighly organized and detail-focused, able to synthesize information in a clear and concise way', '\nAbility to use tact, discretion, maintain confidentiality and sound judgment', '\nAttuned to current social issues related to diversity, equity and inclusion', '\nCommunicator', '\nInsightful', '\nMeticulous', '\nProblem solver']",0,0,0,1,0,1,1,0,0
126,9c060b4eb19efbf8,SR. MACHINE LEARNING ENGINEER (DIGITAL & DATA SCIENCE),The Globe and Mail,"Toronto, ON","['Real time and batch distributed computation', 'Serverless and infrastructure-free process development', 'Machine learning integration', 'Scalable, fast and high availability API design and development', 'Relational, non-relational, and graph database design and data integration', 'A/B, multivariate and champion-challenger system design and development', 'Data and AI product stack and pipeline architectural design, guidance and review', 'System automation and optimization with continuous integration and development', 'System monitoring design and development with the best cloud security practices', 'The ideal candidate will have a keen interest in learning new technology, utilizing them to solve business problems.', 'Develop serverless application, API and distributed data pipelines to process large volumes of all of our Globe and Mail digital assets data', 'Automate existing and new processes, data flows and applications to optimize efficiency', 'Design and build architect / infrastructure diagram and document the processes and flows', 'Contribute into our common AI core platform design, development and integration, such as automatic summarization, trending topic detection and focus prediction', 'Implement machine learning supervised model and generative model for revenue-based prediction and more efficient decision making', 'Work and collaborate with other engineers, solution architects and data scientists in the team to share knowledge, reconcile the process and modularize work', 'Strong SQL skills, including but not limited to PostgreSQL', 'Strong Knowledge of Python and Elasticsearch Queries', 'Understanding of Docker', 'Ability to quickly and efficiently diagnose data issues', 'Ability to create and maintain automated data-alerts', 'Knowledge of version control systems, GIT preferred', 'Must have personal accountability with self-motivation', 'Proficient with Python and AWS', 'Adaptability to start-up like environment and ability to work under the pressure and tight deadlines', 'Fast turnaround with high willingness to learn and take challenges and not afraid of getting hands dirty', 'Nice to have: Spark, Scala, Java', 'Nice to have: Strong business acumen and big picture thinker with a genuine curiosity for cutting edge technology']",1,0,0,0,0,1,0,0,1
127,a74725b9e6d5ed69,Software Engineer III,CDK Global,"Toronto, ON","['\nDesign and implement software modules. Create design documents and module specifications from the direction of other software engineers, project leads, or supervisor. Create interfaces to or from other applications or databases.', '\nCode programs or modifications to existing programs or modules.', '\nDevelop application test plans. This can include regression, integration, or full system test plans.', '\nPerform debugging, unit, and system level testing on programs.', '\nCoaching and mentoring other developers.\n', 'Update and review object, module, program, and application documentation.', '\nReview and provide input to technical writers, training developers on application specific publications, on-line help implementation, and if appropriate, training class development.', '\nDevelop and implement application test plans, including both integration and full system test plans for publications, software and training materials.', '\nCreate program specifications to ensure proper direction during development.', '\nParticipates in code reviews for other development projects.', '\nBS/BA degree in Computer Science, Math, or equivalent education/experience.', '\n5+ years programming experience required.', '\nTraining and experience with Agile software development.', '\nAnalysis and design experience.', '\nExperience and training in formal testing methods helpful.', '\nExposure to a breadth of programming languages with expert level proficiency in at least one language. Java, Spring and Angular are an asset.', '\nTroubleshoot technical problems and demonstrate problem solving and resourcefulness in obtaining information.', '\nCommunicate effectively verbally and in writing.', '\nWork as a team member, with limited supervision.', '\nDemonstrated time management and completion of tasks to a definite deadline.']",0,0,0,0,0,0,0,0,0
128,e3d7a06b782ad9df,Research Scientist,Altus Assessments,"Toronto, ON","['You will have earned the respect and trust of our academic partner programs who see you as deeply knowledgeable about psychometrics and selection in academic admissions', 'You will have earned the respect of the Altus team for your endless curiosity and creative problem-solving - always with another question, and the drive to find the answer quickly', 'You will be known for your speed of execution and will always be looking for creative ways to accelerate academic research\n', 'You will have earned the respect of your peers for your deep insights and perspective on problems - how we might analyze data differently or present data differently to help our partner programs or create better product', 'You will be able to take research findings and translate them into different media (abstracts, academic papers, etc.) in a way that is easy to understand by all audiences', 'You are known to be able to juggle the workload of multiple simultaneous projects - using project management and tools to ensure project progress smoothly\n', 'You have earned the trust of your colleagues as being very reliable - if you say something is getting done, it gets done!', 'You are on your way to being an emerging thought leader in educational research through submitting academic papers along with attending and speaking at conferences', 'Masters degree in psychology, education, or other social or health science related discipline', 'Experience with scientific research and methodologies - this position will require the application of multiple methodological approaches because of the diverse questions we need to answer', 'Experience designing and distributing surveys for academic research; experience with an online survey development platform (e.g., SurveyMonkey, Qualtrics) an asset', 'Experience with Research Ethics Boards (REB) and Internal Research Boards (IRB) and their related submissions, along with grant applications', 'Experience with using statistical software and conducting analysis (i.e. R, SPSS, SAS)\n', 'Experience in communicating information for both an academic audience (i.e. formal ways like academic articles, white papers) and a lay audience (i.e. blog posts, social media)\n', 'Optional: Experience in qualitative research methods (e.g., critical incident technique, thematic analysis, narrative analysis) and software (e.g. NVivo)', 'Optional: Proficiency in French', 'Able to live our core values of Caring, Curious, and Driven to help us attain our goal of creating a world full of exceptional professionals', 'We need someone who is a self-starter, highly curious about how the business works, and able to help us focus where it counts', 'Has loosely held, strong opinions - knows why they want what they want, but is also abundantly humble, can be wrong, and wants to seek out the best solution, no matter the source', 'Interested in being part of an amazing, caring team, and wants to build a sustainable, high growth business', 'Ability to thrive in fast-paced environments and prefer change over status-quo', 'Nurturing and empathetic with a professional, positive attitude and a sense of humility', 'Bonus: Bilingual would be an asset\n', 'Free snacks, drinks, and coffee in our office', 'Monthly team lunches', '$1500 annual personal and professional development budget', 'Generous self-directed vacation policy', 'Comprehensive health, dental and life insurance coverage', 'RRSP Matching Program', 'Extended Parental leave coverage', 'Team building and social events', 'Pre-screen. When you submit your application, it is sent directly to the hiring manager who will screen the application.', 'First phone call. If selected, our hiring manager will schedule a time for the first phone screen, which typically lasts about 30 minutes. The manager will ask you some general interview questions such as why you are interested in this role and then may ask for you to elaborate on some parts of your application.', 'On-site team interview. Once you pass the first phone screen, we will schedule an on-site team interview, where you will meet with 4-6 members of our team to assess your technical skills, values fit, and cultural add. You may also be asked to complete a short task that closely mirrors some aspects of the role. The in-person interview takes about 2-3 hours.', 'Final phone call. Once all the members have met and shared their thoughts, the hiring manager will consolidate this information and let you know of their decision. We may need to ask you a few more questions if there were any areas that needed a bit more expanding.']",0,0,0,0,1,0,1,0,0
129,9fdcb00956683c4d,Financial Analyst II,University Health Network,"Toronto, ON","['\nPrepare invoice/billings. Maintain accurate accounts receivable ledger and track/make collections on an ongoing basis. Ensure revenue promptly collected and accurately reconciled. Liaise with Research financial services, A/R as needed.', '\nReviews assigned accounts, financial reports, fund or account statements, statistics and/or bank statements, etc., to reconcile to general ledger, as assigned. Analyzes and balances information and transactions to verify their accuracy, reasonability and completeness', '\nIdentifies discrepancies and investigates to obtain explanations, missing information or corrections as well as notifying the supervisor/manager of unresolved discrepancies', '\nSupport research operations and principal investigator in financial management of grants and program budget and expenses. Prepares and make presentation to managers/directors on complex analyses and/or reports providing thorough and informative explanations of results.', '\nManage large ACCESS database, analyzes and interprets data and produce reports. Identifies trends, significant transactions or deviations from standards and recommends action to be taken.', '\nAssists in forecast preparation and budget review.', '\nConducts or assists in special projects or business cases, as assigned', '\nAssists in the development and delivery of training sessions on finance and related systems and procedures for UHN management and staff', '\nOther duties assigned relevant to the position', '\nUniversity degree in Business Administration or equivalent program, required or relevant combination of education and experience.', '\nThree (3) years related experience in an accounting environment with exposure to a range of accounting principles practices and procedures, required', '\nWorking knowledge of computer application accounting systems and software applications, preferably in a Microsoft Office environment (Excel & Access is required; SAP or ORACLE is perferred)', '\nGood organizational and time management skills required', '\nGood oral and written communication skills required', '\nDemonstrated commitment to client service and satisfaction required', '\nWorking knowledge of accounting practices, procedures and generally accepted accounting principles required', '\nSkill in accurately performing detailed numerical computations using large amounts of financial and/or statistical data required', '\nSkill in preparing detailed reports required', '\nDemonstrated problem solving skills required', '\nKnowledge of basic leadership practices required']",0,1,0,1,0,0,0,0,0
